<?xml version="1.0" encoding="UTF-8"?>
<xs:schema xmlns:xs="http://www.w3.org/2001/XMLSchema"
           elementFormDefault="qualified">

    <xs:element name="hospital">
        <xs:complexType>
            <xs:sequence>
                <xs:element name="name" type="xs:string"/>
                <xs:element name="queueSettings">
                    <xs:complexType>
                        <xs:sequence>
                            <xs:element name="defaultAverageConsultationTime" type="xs:positiveInteger"/>
                            <xs:element name="maximumOnlineBookings" type="xs:positiveInteger"/>
                            <xs:element name="checkInRequired" type="xs:boolean"/>
                        </xs:sequence>
                    </xs:complexType>
                </xs:element>
                <xs:element name="departments">
                    <xs:complexType>
                        <xs:sequence>
                            <xs:element name="department" maxOccurs="unbounded">
                                <xs:complexType>
                                    <xs:sequence>
                                        <xs:element name="name" type="xs:string"/>
                                        <xs:element name="room" type="xs:string"/>
                                        <xs:element name="averageTime">
                                            <xs:simpleType>
                                                <xs:restriction base="xs:integer">
                                                    <xs:minInclusive value="1"/>
                                                    <xs:maxInclusive value="120"/>
                                                </xs:restriction>
                                            </xs:simpleType>
                                        </xs:element>
                                    </xs:sequence>
                                    <xs:attribute name="id" type="xs:ID" use="required"/>
                                </xs:complexType>
                            </xs:element>
                        </xs:sequence>
                    </xs:complexType>
                </xs:element>
            </xs:sequence>
        </xs:complexType>
    </xs:element>

</xs:schema>
